sentID.BTEC	split	lang	sent
14407	corpus-6-train	EN	If available, I would like an automatic.
14408	corpus-6-train	EN	This headset isn't working very well. Can you give me another one?
14410	corpus-6-train	EN	You look nice.
14412	corpus-6-train	EN	Are there any motels near here? Please draw me a map.
14413	corpus-6-train	EN	"Do you still have tickets for ""Big River"" for tonight?"
14415	corpus-6-train	EN	It looks almost the same.
14416	corpus-6-test-corpus-26-train	EN	You look beautiful.
14418	corpus-6-train	EN	What is the material of this suit?
14419	corpus-6-train	EN	It's two hours prior to departure.
14424	corpus-6-train	EN	We want to share that order between the three of us.
14426	corpus-6-test-corpus-26-test	EN	I'd like a twin bed room. How much is the room per night?
14430	corpus-6-dev	EN	Some fruit, please.
14431	corpus-6-train	EN	It's important.
14432	corpus-6-train	EN	Please leave them outside.
14434	corpus-6-test-corpus-26-train	EN	It is about ninety-nine miles away.
14435	corpus-6-train	EN	Good afternoon. I have an appointment with Dr. Drille at three o'clock today, but I'm afraid I'll be little late. Will that be all right?
14437	corpus-6-train	EN	Do you have something with keys?
14438	corpus-6-train	EN	S seats are sold out, but we still have A seats.
14439	corpus-6-train	EN	We want to share this food. Could you bring small plates?
14440	corpus-6-train	EN	I feel sick at my stomach.
14441	corpus-6-test-corpus-26-train	EN	Vince and Linda want to be alone, so I'm afraid I'm gonna have to stay here tonight.
14444	corpus-6-test-corpus-26-train	EN	Please keep this baggage in bond.
14447	corpus-6-train	EN	Reduce the price.
14448	corpus-6-test-corpus-26-train	EN	My name is Sato.
14451	corpus-6-train	EN	Could I speak to a Japanese operator?
14452	corpus-6-train	EN	I'd like to know what the charge for a telephone call to New York is.
14453	corpus-6-train	EN	Not really, I'm afraid. You take the subway here at your own risk, so to speak.
14454	corpus-6-train	EN	"For those who have finished work it's ""Thank you very much"" to express gratitude."
14455	corpus-6-train	EN	They got away with pearl necklace and other valuable things.
14457	corpus-6-test-corpus-26-train	EN	I know an old jazz club downtown.
14459	corpus-6-test-corpus-26-train	EN	I'll take this table d'hote.
14461	corpus-6-train	EN	Will you show me the way to the hospital?
14462	corpus-6-test-corpus-26-dev	EN	I'd like to try the same dish as that one.
14463	corpus-6-train	EN	I want to go to the Tower of London.
14464	corpus-6-train	EN	I'd like to get off here.
14466	corpus-6-train	EN	Can I have a medical certificate?
14467	corpus-6-train	EN	Here is a photocopy of my ticket.
14468	corpus-6-train	EN	It's a blue compact car, license plate number KAY three one five and registration number PRI four five six zero.
14471	corpus-6-train	EN	Will you give me a little discount?
14472	corpus-6-dev	EN	Do you play any sports?
14473	corpus-6-train	EN	There's a high demand for this style among collectors.
14474	corpus-6-train	EN	We do have plugs and sockets used in our own country, but not transformers. I suggest you go to a store dealing with tourist items.
14475	corpus-6-test-corpus-26-train	EN	Then we'll take it.
14476	corpus-6-train	EN	Can I see you tomorrow afternoon?
14477	corpus-6-test-corpus-26-train	EN	Does this go up to the sixth floor?
14478	corpus-6-test-corpus-26-dev	EN	Alligator skin?
14479	corpus-6-train	EN	Watch out.
14480	corpus-6-train	EN	Two cream-of-tomato, please.
14482	corpus-6-dev	EN	Is it within walking distance? Or is it too far to walk?
14483	corpus-6-test-corpus-26-train	EN	Please put it in a laundry bag and leave it there.
14484	corpus-6-test-corpus-26-train	EN	I'd like to have this film developed. When will it be ready?
14485	corpus-6-train	EN	Yes. I'd like two tickets for A Streetcar Named Desire. Do you have any tickets left for tonight's show?
14493	corpus-6-train	EN	Is this the right flight?
14495	corpus-6-test-corpus-26-dev	EN	Please don't give this key to anyone other than myself.
14497	corpus-6-train	EN	Do some light exercises and do a massage after you take a bath every day.
14499	corpus-6-train	EN	There is only one exit.
14500	corpus-6-test-corpus-26-test	EN	Okay. I'll pick you up at your hotel at eight o'clock.
14502	corpus-6-test-corpus-26-train	EN	Window is fine.
14505	corpus-6-test-corpus-26-train	EN	Let my bangs hang down, please.
14507	corpus-6-test-corpus-26-train	EN	Are all the transportation expenses included?
14508	corpus-6-train	EN	I'm afraid you misunderstood the dates.
14509	corpus-6-test-corpus-26-train	EN	Metropolitan Opera House.
14510	corpus-6-train	EN	My friend from here is gonna pick me up, so it's okay.
14511	corpus-6-train	EN	This room is too noisy.
14512	corpus-6-train	EN	I don't have the courage to wear something like that.
14514	corpus-6-test-corpus-26-train	EN	Where's the rent-a-car counter?
14515	corpus-6-train	EN	Ginkgo trees are very beautiful when their leaves turn yellow in the fall.
14517	corpus-6-dev	EN	I have a party tonight. So, set my hair, please.
14518	corpus-6-train	EN	Are you asking me if we play to begin selling our products in the U.S.?
14519	corpus-6-test-corpus-26-dev	EN	I've been feverish since last night.
14520	corpus-6-test-corpus-26-train	EN	It's not my taste.
14521	corpus-6-dev	EN	How do you pronounce this place name?
14524	corpus-6-train	EN	Please charge it to my Master Card.
14525	corpus-6-dev	EN	How much is your advertising budget?
14528	corpus-6-train	EN	Where are the toilets?
14529	corpus-6-train	EN	I'd like to sleep.
14530	corpus-6-test-corpus-26-train	EN	What vegetables do you have?
14531	corpus-6-test-corpus-26-test	EN	I would like a loose permanent, please.
14534	corpus-6-test-corpus-26-train	EN	When will the doctor come?
14535	corpus-6-train	EN	I'm afraid it's about three minutes slow.
14537	corpus-6-test-corpus-26-train	EN	It's the wrong color.
14538	corpus-6-test-corpus-26-train	EN	The tooth has broken off.
14542	corpus-6-test-corpus-26-train	EN	Is this an aisle seat or a window seat?
14543	corpus-6-train	EN	You can't be on a diet with that slim figure of yours.
14544	corpus-6-train	EN	I'll be fifteen minutes late for the meeting.
14545	corpus-6-train	EN	One with the store name, please. I'll use it for my insurance claim.
14547	corpus-6-train	EN	It is for my personal use.
14551	corpus-6-dev	EN	I would like someplace where I can have some local cuisine.
14552	corpus-6-train	EN	I'd like a tripod, please.
14555	corpus-6-train	EN	I want a cheaper bag.
14556	corpus-6-train	EN	I was suddenly attacked by a terrible back pain.
14557	corpus-6-test-corpus-26-train	EN	I'm into hiking.
14561	corpus-6-dev	EN	I'd like to leave as soon as possible. Is there any earlier flight?
14562	corpus-6-dev	EN	Thank you for all the tips. You're very kind.
14564	corpus-6-test-corpus-26-dev	EN	Can you deliver my baggage to the room?
14565	corpus-6-train	EN	What kind of model would you like?
14566	corpus-6-train	EN	How about ten pounds for three?
14567	corpus-6-train	EN	Keep going down this street till you come to a small park.
14568	corpus-6-train	EN	I'd like it.
14569	corpus-6-train	EN	What color do you have in mind?
14570	corpus-6-dev	EN	We'd like to have a table near the window.
14571	corpus-6-train	EN	I'm sorry, but they are all sold out.
14573	corpus-6-test-corpus-26-train	EN	Show me one for a young lady.
14574	corpus-6-train	EN	So everything around here is new to you, isn't it?
14576	corpus-6-train	EN	May I look around?
14578	corpus-6-train	EN	Um, what particular aspects of this country are you interested?
14579	corpus-6-train	EN	Could we keep our room for about thirty minutes after check out time?
14580	corpus-6-train	EN	Sorry, wrong number.
14582	corpus-6-train	EN	A lot larger table, please.
14585	corpus-6-train	EN	Of course. It's nothing. Don't worry about that. I hope you'll be more careful the next time.
14586	corpus-6-train	EN	Will you show me how to turn on the light?
14587	corpus-6-train	EN	Please show me the one in the display case.
14590	corpus-6-test-corpus-26-train	EN	Can you pull up over here?
14591	corpus-6-train	EN	Is there any change in our schedule?
14592	corpus-6-train	EN	I'll serve.
14593	corpus-6-test-corpus-26-dev	EN	Do you have anything for about eighty dollars and zero cents?
14595	corpus-6-train	EN	And most streets do not have names or signs. So it is pretty difficult to get to a destination just by its address.
14597	corpus-6-train	EN	He is a rip-off artist. So, please be careful.
14598	corpus-6-train	EN	Please give me suntan cream.
14600	corpus-6-train	EN	Please call a taxi for me.
14601	corpus-6-train	EN	Is it fresh?
14602	corpus-6-train	EN	How much is it to rent a court per hour?
14604	corpus-6-train	EN	I'll give you two dollars to make it two hundred dollars.
14605	corpus-6-test-corpus-26-train	EN	I'm thirsty.
14606	corpus-6-train	EN	Is it on the left or right?
14607	corpus-6-train	EN	I want a pair of trousers.
14608	corpus-6-train	EN	I just want to take a relaxing walk.
14609	corpus-6-train	EN	Can I charge it?
14610	corpus-6-train	EN	How much is it to Japan by airmail?
14611	corpus-6-train	EN	Could I have two cartons of Seven Stars?
14612	corpus-6-test-corpus-26-train	EN	No milk, please.
14613	corpus-6-train	EN	Do you know your ticket number, travel agency, date of issue and method of payment?
14614	corpus-6-train	EN	How much is the room per night?
14615	corpus-6-train	EN	You win. Five will be fine.
14616	corpus-6-dev	EN	I want to return to the hotel to find my camera.
14617	corpus-6-train	EN	It's a matter of life and death.
14618	corpus-6-train	EN	You should take a taxi, as there isn't any public transportation.
14619	corpus-6-train	EN	There are twelve pro-baseball teams in Japan.
14622	corpus-6-train	EN	In the third block on your left.
14623	corpus-6-dev	EN	I would like to make a station-to-station call to Tokyo, please.
14626	corpus-6-train	EN	I want to meet.
14627	corpus-6-train	EN	Won't you play tennis with me next week?
14630	corpus-6-train	EN	Shall we ride on that one?
14631	corpus-6-train	EN	Excuse me. I'm looking for a leather jacket.
14632	corpus-6-train	EN	What a great meal.
14634	corpus-6-train	EN	What clothing store do you recommend?
14637	corpus-6-train	EN	Could I have the meat loaf, and cancel the steak I ordered?
14638	corpus-6-train	EN	The three of us would like to play a round. How much will it be?
14642	corpus-6-train	EN	We'll arrive thirty minutes ahead of schedule.
14643	corpus-6-train	EN	Thank you for your call.
14644	corpus-6-train	EN	Cigars, please, if you have any. How much are they?
14646	corpus-6-train	EN	I'd like a wake-up call.
14648	corpus-6-dev	EN	Which one is the Jungfrau?
14650	corpus-6-dev	EN	Can you make it in half an hour?
14652	corpus-6-train	EN	I would like a bus route map, please.
14653	corpus-6-train	EN	You are to blame for the accident.
14659	corpus-6-train	EN	Go straight down this street about five blocks, and there's a drugstore on the corner. When you get there, turn right. You'll see it just on your left.
14660	corpus-6-train	EN	Please speak more slowly.
14661	corpus-6-train	EN	What are you showing next week, please?
14662	corpus-6-train	EN	We plan to take nine hours.
14665	corpus-6-train	EN	I'm looking forward to seeing the changing of the guard.
14666	corpus-6-train	EN	Wow. Everyone's dancing like crazy.
14667	corpus-6-train	EN	May we stay on board, because we are with a child?
14669	corpus-6-train	EN	What's on at the National Theater?
14670	corpus-6-train	EN	Can I get a room for tonight?
14674	corpus-6-dev	EN	Yes, I'm bringing a Japanese doll for my friend.
14675	corpus-6-train	EN	Where is the Japan Airline counter?
14677	corpus-6-train	EN	What a great concert. You like it?
14678	corpus-6-train	EN	I'm declaring this item.
14681	corpus-6-train	EN	Nice to meet you, too, Bobby. Would you like to go swimming with us?
14683	corpus-6-test-corpus-26-dev	EN	I have three bags.
14685	corpus-6-test-corpus-26-train	EN	Where is the lake?
14686	corpus-6-train	EN	I don't want to eat now.
14687	corpus-6-train	EN	I'd like sunny-side up.
14688	corpus-6-train	EN	Please let the waist out by three centimeters.
14689	corpus-6-train	EN	I'm looking for an interesting souvenir from Las Vegas.
14690	corpus-6-train	EN	This is not what I ordered.
14691	corpus-6-train	EN	Where do you do your studying? Do you study in the room here, or do you go to the library?
14693	corpus-6-test-corpus-26-test	EN	Excuse me. Press the shutter, please.
14696	corpus-6-train	EN	Yeah, but you ain't no gentleman, are you?
14697	corpus-6-train	EN	I'd like new lenses.
14699	corpus-6-train	EN	I need a little more time.
14701	corpus-6-train	EN	What time does the show begin?
14702	corpus-6-train	EN	I'll have that one.
14705	corpus-6-train	EN	I want to do some shopping in this city. Could you recommend me a good department store or a shopping mail?
14706	corpus-6-train	EN	I don't have much time. Will it take long?
14707	corpus-6-dev	EN	They are typhoons. Once hitting Japan they cause us a lot of disasters.
14709	corpus-6-test-corpus-26-train	EN	May I have a magazine or something?
14710	corpus-6-train	EN	I think we do. I'll check and be right back.
14711	corpus-6-train	EN	Tell me, Mr. Morita, is your wife accompanying you here in New York?
14712	corpus-6-train	EN	You change the trains at the third station.
14713	corpus-6-train	EN	Which bus goes to Central Station?
14714	corpus-6-train	EN	We've been married for only two days.
14717	corpus-6-dev	EN	I want a replica of Lee Riders nineteen forty-four one o one model.
14718	corpus-6-test-corpus-26-train	EN	It's south.
14719	corpus-6-train	EN	Excuse me, will it take much longer for our meal?
14720	corpus-6-train	EN	I prefer Italian food.
14721	corpus-6-test-corpus-26-train	EN	How much are balcony seats?
14722	corpus-6-train	EN	You can ask at that information desk over there, if you get lost.
14723	corpus-6-train	EN	Will you wrap these separately?
14729	corpus-6-train	EN	We will take off in a few minutes. Please make sure that your seat belt is securely fastened.
14731	corpus-6-dev	EN	Yes, but please don't let them go in the deep end or the jacuzzi.
14733	corpus-6-train	EN	When's the World Series?
14734	corpus-6-test-corpus-26-test	EN	We'd like a room overlooking the lake.
14737	corpus-6-test-corpus-26-train	EN	Are there any mailboxes near here?
14738	corpus-6-train	EN	I want to buy a brief-case.
14740	corpus-6-train	EN	Where were you?
14741	corpus-6-train	EN	If I had persisted a bit longer, I might have gotten it for less.
14742	corpus-6-train	EN	Which one do you want, for five pounds or ten?
14743	corpus-6-train	EN	I feel sick. Where is the ship doctor?
14745	corpus-6-train	EN	I come from Greece.
14746	corpus-6-train	EN	Suit your taste?
14747	corpus-6-dev	EN	What time are you open?
14749	corpus-6-dev	EN	There's one in the back of this hall.
14752	corpus-6-train	EN	I'll stay with my friend tonight.
14753	corpus-6-train	EN	I'm afraid your checking account is overdrawn.
14754	corpus-6-train	EN	It's twenty after four.
14755	corpus-6-train	EN	Oatmeal and two eggs, with sausages, and milk tea.
14757	corpus-6-test-corpus-26-train	EN	All right. I'll take you there.
14758	corpus-6-train	EN	This is my hotel address and phone number. Would you call me at this number as soon as my bag is found?
14759	corpus-6-train	EN	Would you prefer a table in the smoking or non-smoking area?
14761	corpus-6-test-corpus-26-train	EN	The part written in italics refers to changes that have occurred in the nineteen nineties.
14762	corpus-6-train	EN	I'd like to eat a lot of vegetables today.
14763	corpus-6-test-corpus-26-train	EN	He is thirty years old.
14764	corpus-6-train	EN	I have my ID. Driver's license okay?
14766	corpus-6-train	EN	A half day is thirty dollars. All day is fifty dollars.
14770	corpus-6-train	EN	A surfboard costs twenty-five dollars for two hours and forty dollars for a full day.
14772	corpus-6-train	EN	It's too warm. Would you adjust the air-conditioning?
14774	corpus-6-train	EN	What's today's rate for yen?
14775	corpus-6-dev	EN	This is Sugita in room thirteen twenty. I just checked in, but this room is smaller than I expected. Could I change rooms?
14777	corpus-6-test-corpus-26-test	EN	All right. Could you write the address once more on this envelope?
14778	corpus-6-train	EN	Does the Fifth Avenue bus stop here?
14781	corpus-6-train	EN	I have cash to cover meals for three days.
14783	corpus-6-test-corpus-26-train	EN	I'd like to go to the Harrods. Could you draw a map, please?
14784	corpus-6-train	EN	Where can I buy folkcraft goods?
14786	corpus-6-test-corpus-26-train	EN	What do you do when you have spare time?
14787	corpus-6-train	EN	How do I make an overseas call?
14788	corpus-6-train	EN	What are the popular sports in Japan?
14789	corpus-6-test-corpus-26-train	EN	Do you have batteries for this camera?
14790	corpus-6-train	EN	Would you please fax me a map to get to your office?
14791	corpus-6-train	EN	Are you ready to order, ma'am?
14792	corpus-6-train	EN	We recommend you take the Boston City Tour. This gives you a chance to see the main points of interest in Boston.
14794	corpus-6-train	EN	I'm trying to locate this address on this card.
14796	corpus-6-train	EN	Hello. Is this Boston Insurance?
14797	corpus-6-train	EN	Is there a beauty parlor in this hotel?
14798	corpus-6-train	EN	It was a most delicious meal.
14799	corpus-6-train	EN	Now he has goofed it.
14801	corpus-6-train	EN	Which part of Austria?
14805	corpus-6-test-corpus-26-train	EN	I'd like a cable release.
14807	corpus-6-test-corpus-26-train	EN	Are you the last in this line?
14809	corpus-6-train	EN	Where does this train go to?
14810	corpus-6-test-corpus-26-train	EN	I think it is overbooked.
14813	corpus-6-test-corpus-26-train	EN	Good shot. Just out.
14814	corpus-6-train	EN	May I use the telephone?
14815	corpus-6-train	EN	What's the maximum length for parcel post?
14816	corpus-6-train	EN	I'd like it at eight thirty.
14818	corpus-6-test-corpus-26-train	EN	Can you tell me the places of interest here?
14820	corpus-6-test-corpus-26-train	EN	Are there any department stores near here?
14821	corpus-6-train	EN	A table for two, please.
14823	corpus-6-train	EN	Can you tell me if there are any good seafood restaurants around here?
14824	corpus-6-train	EN	Okay. The Empire State Building is right on this road here. What you want to do is go to the bus stop over here on the corner and take it straight down. It'll be on your right.
14825	corpus-6-train	EN	What's the price of this?
14829	corpus-6-train	EN	Which would you like for dessert, ice cream or sherbet?
14835	corpus-6-train	EN	That's not possible with my budget.
14837	corpus-6-train	EN	Do we have to order a full course?
14840	corpus-6-train	EN	No, we're not ready yet.
14841	corpus-6-train	EN	I've got a reservation for two nights.
14842	corpus-6-train	EN	Do you have any whisky?
14843	corpus-6-train	EN	Could you call me if you find my bags?
14844	corpus-6-train	EN	May I see your driving license, please?
14845	corpus-6-train	EN	Who should say is calling, please?
14846	corpus-6-train	EN	How does this look on me?
14848	corpus-6-train	EN	No, very few. That may be one of the reasons why women don't stick with one company.
14849	corpus-6-train	EN	How long does it take to get a reissued passport?
14852	corpus-6-train	EN	Wrap, please.
14853	corpus-6-train	EN	It is improving.
14854	corpus-6-test-corpus-26-dev	EN	So do I.
14857	corpus-6-train	EN	I'll have some butter.
14859	corpus-6-train	EN	I took the wrong bus.
14860	corpus-6-dev	EN	How big?
14862	corpus-6-test-corpus-26-train	EN	I'd like to join from San Diego.
14863	corpus-6-test-corpus-26-train	EN	I was thinking of taking that course next semester.
14866	corpus-6-train	EN	Could you cook this meat a little more?
14867	corpus-6-train	EN	Please call for a doctor.
14871	corpus-6-train	EN	I'll take an X-ray.
14873	corpus-6-train	EN	Is there a place to change money?
14874	corpus-6-train	EN	I'd like a perm.
14876	corpus-6-train	EN	May I have some cereals?
14877	corpus-6-train	EN	No, I'm afraid I couldn't go to sleep because of that bad news.
14878	corpus-6-train	EN	How do you calculate the cancellation fee?
14879	corpus-6-train	EN	Our trip starts on the twenty-first of July and finishes on the twenty-seventh.
14881	corpus-6-train	EN	I'm not interested.
14884	corpus-6-train	EN	How do you pronounce this station?
14885	corpus-6-train	EN	I'll pay by myself.
14886	corpus-6-train	EN	Is the museum open today?
14887	corpus-6-test-corpus-26-train	EN	The wine isn't cool enough. Will you make it cooler?
14889	corpus-6-train	EN	Let me see a different one.
14890	corpus-6-train	EN	Like this, please.
14895	corpus-6-train	EN	I'm great, too, thanks.
14897	corpus-6-dev	EN	How long are you gonna be in New York City?
14899	corpus-6-train	EN	Can I cancel my dessert? I've already had enough.
14901	corpus-6-test-corpus-26-dev	EN	Can you alter these earrings to clip-ons?
14902	corpus-6-train	EN	Is there an airport bus to the Sheraton Hotel?
14903	corpus-6-test-corpus-26-train	EN	What are you most interested in now?
14905	corpus-6-test-corpus-26-train	EN	I'd like a refund. Can I get my money back?
14907	corpus-6-train	EN	Yes. Number four eighty-seven.
14910	corpus-6-train	EN	Just one now.
14911	corpus-6-train	EN	Right out in front. You'll see the sign. You can't miss it.
14912	corpus-6-train	EN	You'll have to take it to the gift-wrap counter.
14915	corpus-6-train	EN	How long does it take to press it?
14916	corpus-6-train	EN	I hope I'll be able to visit your country.
14918	corpus-6-train	EN	Tell me straight.
14919	corpus-6-train	EN	What is the delivery date?
14921	corpus-6-dev	EN	Draw me a map, please.
14923	corpus-6-train	EN	I don't have a reservation here, but do you have a room for two nights?
14925	corpus-6-train	EN	I want checkout now. Can you take my baggage down?
14926	corpus-6-test-corpus-26-train	EN	I probably can't get a drink like this anywhere else.
14927	corpus-6-train	EN	Which way is the south?
14933	corpus-6-test-corpus-26-train	EN	If you buy this too, it makes the duty-free amount.
14935	corpus-6-train	EN	Could I have a blanket?
14936	corpus-6-train	EN	Did he say the next stop is twenty-third Street?
14937	corpus-6-train	EN	Must I make a reservation for the dining-car?
14939	corpus-6-train	EN	Good evening. Do you have any open tables for two?
14940	corpus-6-train	EN	What are your hobbies?
14941	corpus-6-train	EN	Yes. How much do I have to deposit to start with?
14942	corpus-6-train	EN	Yes, I'll have a draft beer with the hors d'oeuvres.
14945	corpus-6-train	EN	Please clean this blouse.
14946	corpus-6-train	EN	Is there anything you want left off?
14947	corpus-6-train	EN	Yes, I'm free.
14948	corpus-6-train	EN	What was stolen?
14951	corpus-6-train	EN	He was tall with blond hair.
14952	corpus-6-test-corpus-26-train	EN	May I see your certificate of vaccination, please?
14954	corpus-6-train	EN	Which are the cigarettes?
14956	corpus-6-train	EN	Put a napkin on one and crush it with that hammer.
14957	corpus-6-train	EN	The bus runs at night when there is less traffic. So it is seldom delayed.
14958	corpus-6-dev	EN	I've been constipated for five days.
14959	corpus-6-train	EN	Certainly. I'll take you there.
14960	corpus-6-test-corpus-26-train	EN	Do you travel a lot?
14964	corpus-6-dev	EN	Can you lend me a towrope?
14967	corpus-6-train	EN	Your house is very big.
14969	corpus-6-test-corpus-26-train	EN	I come from the U.S.
14970	corpus-6-train	EN	May I have tea instead of coffee?
14972	corpus-6-train	EN	I don't think we've met before.
14973	corpus-6-train	EN	Do you have a spare postal card?
14975	corpus-6-dev	EN	Would you be able to mail these for me?
14976	corpus-6-test-corpus-26-train	EN	I have an air ticket for San Francisco.
14977	corpus-6-train	EN	I'd like some coffee.
14978	corpus-6-train	EN	Where's the Japanese Consulate?
14979	corpus-6-train	EN	I'd like some rice.
14981	corpus-6-train	EN	Yes, there is. Here comes the train. Have a good day.
14984	corpus-6-dev	EN	Could I have some mustard?
14985	corpus-6-train	EN	Could you send a fax to this number?
14986	corpus-6-train	EN	Can we meet at three p.m. instead?
14987	corpus-6-dev	EN	I lose perspective when I go overseas, and I waste money right and left.
14989	corpus-6-train	EN	Apple pie, please.
14990	corpus-6-train	EN	How many paid holidays do you get a year?
14991	corpus-6-train	EN	Table for four, please.
14993	corpus-6-train	EN	Say.
14994	corpus-6-train	EN	Right. Would you like to go to the pool with me?
14995	corpus-6-train	EN	That would be great. I've been waiting for a chance to do something like that.
14996	corpus-6-train	EN	I wish to propose a toast to our Mr. William.
14997	corpus-6-train	EN	Thank you, I will. We hope you'll also come over to our place some time.
14998	corpus-6-test-corpus-26-train	EN	If it's only fifteen minutes from the station, then I'll walk.
14999	corpus-6-train	EN	I'd like to go to the A museum.
15001	corpus-6-train	EN	I'm thinking of taking advantage of the special discount ABC Airlines is offering to Hawaii next month.
15004	corpus-6-train	EN	I think so. You'll be all right.
15005	corpus-6-dev	EN	"Can I have two tickets for ""Les Miserables"" for June seventh?"
15008	corpus-6-train	EN	Do you sell only new books, or do you also handle second-hand volumes?
15009	corpus-6-train	EN	I want to send a letter to Japan.
15010	corpus-6-train	EN	When I was walking along Broadway.
15011	corpus-6-dev	EN	I'd like a food container.
15012	corpus-6-train	EN	One first class single to Calais, please.
15013	corpus-6-train	EN	Please call a taxi at two p.m.
15014	corpus-6-dev	EN	Very well, thank you. And you?
15016	corpus-6-train	EN	Is there anything of interest here?
15019	corpus-6-test-corpus-26-train	EN	I'd like a little cheaper hotel.
15020	corpus-6-test-corpus-26-test	EN	Bonsai sounds like an old person's hobby.
15021	corpus-6-train	EN	Please tell the Japanese consulate after you have reported it to the police.
15023	corpus-6-train	EN	Could I bring all of them? I really need them.
