sentID.BTEC	split	lang	sent
9921	corpus-6-train	EN	The gum is very sore.
9923	corpus-6-train	EN	Can I close the window?
9924	corpus-6-train	EN	But everything comes with those greasy-looking heaps of potatoes. I'm starting to miss rice and miso soup.
9925	corpus-6-train	EN	Could you put someone who speaks Japanese on the line?
9926	corpus-6-train	EN	Some other person's baggage was delivered to my room.
9927	corpus-6-train	EN	Yes. Walk for two blocks. You'll find it on your right.
9929	corpus-6-dev	EN	I'd like to see Trinity Church.
9930	corpus-6-train	EN	Tokyo is a center of fashion.
9931	corpus-6-train	EN	What's on at the opera house on Friday night?
9932	corpus-6-train	EN	I've got asthma.
9933	corpus-6-train	EN	She seasoned the stew with garlic.
9935	corpus-6-train	EN	I prefer SF movies to love stories.
9936	corpus-6-train	EN	Let me check the dollar-yen exchange rate today. Just a moment, please.
9937	corpus-6-train	EN	This is a video cassette tape that I taped for my friend.
9939	corpus-6-train	EN	Five tens, ten fives, and the rest in quarters, please.
9940	corpus-6-train	EN	I'd like to buy some bags.
9941	corpus-6-train	EN	We are going to spend a week camping and enjoy ourselves this summer.
9944	corpus-6-train	EN	I swim and work out in a gym once a week.
9945	corpus-6-test-corpus-26-train	EN	I'm sure the criminal is near.
9946	corpus-6-dev	EN	Flight UA eight five three.
9948	corpus-6-test-corpus-26-train	EN	Ten stamps please.
9949	corpus-6-test-corpus-26-train	EN	I've got a sore throat.
9950	corpus-6-train	EN	That will take two hours and a service charge of ninety-nine dollars.
9951	corpus-6-train	EN	What are the top quality shoes you carry?
9952	corpus-6-train	EN	Why did you go to New York last year?
9955	corpus-6-test-corpus-26-train	EN	I need some souvenirs from New York.
9956	corpus-6-train	EN	I'm from Germany. I stayed Las Vegas for three days before coming here.
9957	corpus-6-train	EN	I want to go by ship, but what are the cabins like?
9959	corpus-6-train	EN	Hey, I feel like I took this street before.
9960	corpus-6-dev	EN	Would you mind making my breakfast an hour earlier than that?
9961	corpus-6-train	EN	If I leave my film now, how soon will the prints be ready?
9964	corpus-6-train	EN	Does another bookstore sell it?
9965	corpus-6-train	EN	Just some stomach medicine.
9966	corpus-6-train	EN	What is the name of the station where I get off?
9967	corpus-6-train	EN	Compulsory education is six years of primary school, and three years of junior high school.
9968	corpus-6-train	EN	How about for two?
9969	corpus-6-test-corpus-26-train	EN	I'm checking out. Can you send a bellboy up?
9970	corpus-6-train	EN	Cruise missiles. What were they used for?
9971	corpus-6-train	EN	Do you have Jack Daniel's?
9974	corpus-6-dev	EN	Do they sell alcohol at the store?
9975	corpus-6-train	EN	Can I hire an instructor for a tennis lesson?
9976	corpus-6-train	EN	Will the bus to El Paso leave on schedule?
9977	corpus-6-train	EN	Is there a sleeping carriage?
9978	corpus-6-train	EN	Could you clear my table, please?
9979	corpus-6-test-corpus-26-train	EN	My watch has stopped.
9980	corpus-6-train	EN	I was speaking with Mr. Douglas of the Sales Department, and we were disconnected.
9981	corpus-6-train	EN	No, we didn't receive messages, but there is a letter for you.
9982	corpus-6-train	EN	I enjoyed it. Thank you.
9983	corpus-6-test-corpus-26-train	EN	Oh, is it? How do you like it?
9984	corpus-6-train	EN	It tastes great, but it wouldn't hurt if they tried to make it look nicer.
9985	corpus-6-train	EN	When's low tide?
9986	corpus-6-train	EN	That sounds good. I'd like to join this tour. How much is it?
9987	corpus-6-train	EN	I dropped this camera and broke the shutter.
9988	corpus-6-train	EN	Can I keep on my trip?
9992	corpus-6-train	EN	We should go to platform number one to board the Chuo Line.
9996	corpus-6-train	EN	I can have it ready for you in about fifteen minutes. Do you want to wait or will you come by later?
9999	corpus-6-train	EN	What time will the next bus come?
10000	corpus-6-train	EN	Where can I order?
10001	corpus-6-dev	EN	What documents do I need for entering the US?
10003	corpus-6-train	EN	By the way, the new Kansai International Airport was also completed in nineteen ninety-four.
10004	corpus-6-train	EN	Do you sell bread?
10006	corpus-6-test-corpus-26-train	EN	We are open at nine o'clock in the morning.
10008	corpus-6-dev	EN	It's very good, thank you.
10010	corpus-6-train	EN	Is this real?
10011	corpus-6-train	EN	May I see the menu?
10012	corpus-6-train	EN	Do you have any appetite?
10015	corpus-6-dev	EN	I want you to make me a new hat.
10017	corpus-6-dev	EN	I'd like something for nausea.
10018	corpus-6-dev	EN	This ticket is for an orchestra seat. You're in the balcony.
10020	corpus-6-train	EN	My name is Tsutomu.
10021	corpus-6-train	EN	Does this train go to New York?
10022	corpus-6-train	EN	We can guarantee that you will receive all of the goods within two weeks of our receiving your order.
10023	corpus-6-train	EN	Okay. Go ahead.
10024	corpus-6-train	EN	Is this a brier pipe?
10025	corpus-6-train	EN	Do I wear it to the left?
10028	corpus-6-train	EN	Is it too far to walk?
10029	corpus-6-train	EN	I'd like a room with shower.
10030	corpus-6-dev	EN	How much do you charge for dropping off the car?
10031	corpus-6-train	EN	Here are old coins, excavated clay pots, bronze pitchers, and a thousand other commodities.
10032	corpus-6-test-corpus-26-train	EN	I'd like a coloring book.
10034	corpus-6-train	EN	Can I have some mineral water?
10035	corpus-6-train	EN	We want to hit.
10036	corpus-6-train	EN	My room is very noisy.
10037	corpus-6-test-corpus-26-train	EN	I think I feel airsick.
10041	corpus-6-train	EN	How can I get to the Delta Airlines connecting flight counter?
10043	corpus-6-test-corpus-26-train	EN	Do I have to go to a Japanese bank?
10044	corpus-6-train	EN	Please try once more.
10045	corpus-6-test-corpus-26-train	EN	You have to exchange money at a bank.
10046	corpus-6-dev	EN	Oh, you shouldn't have. Thank you. It's just what I wanted.
10047	corpus-6-train	EN	I'll give you a ring when I'm free.
10050	corpus-6-train	EN	Does this train stop at every station?
10051	corpus-6-train	EN	The watches in this case are for every day wear and these are higher-priced ones.
10052	corpus-6-train	EN	Here try this for size, it's a thirty-eight regular.
10053	corpus-6-train	EN	I hurt myself.
10055	corpus-6-train	EN	I've heard that you have a waiter who speaks Japanese.
10056	corpus-6-train	EN	What is your handicap?
10057	corpus-6-train	EN	Could I make a reservation?
10058	corpus-6-train	EN	Are you sure? I thought the shape of that wine bottle was used for Burgundy wine.
10059	corpus-6-train	EN	This is my husband.
10060	corpus-6-train	EN	No, thank you. I'm just looking.
10061	corpus-6-train	EN	Yes, it was very good. Thank you.
10063	corpus-6-train	EN	Yes. I'll put you through to Mme. Daudet.
10064	corpus-6-train	EN	May I try this one?
10065	corpus-6-test-corpus-26-train	EN	Is there plenty of time for check-out?
10066	corpus-6-train	EN	I've an allergy to eggs.
10067	corpus-6-train	EN	I'd like to draw your attention to the upper-right-hand section of the sheet I've just given you.
10069	corpus-6-test-corpus-26-train	EN	Your husband's one of our best clients.
10070	corpus-6-train	EN	At Hilton Hotel. Room number is three o five.
10071	corpus-6-train	EN	The sunset is gorgeous from here.
10073	corpus-6-train	EN	I imagine you have concerns about the delivery date.
10074	corpus-6-train	EN	I'd like a pencil sharpener, please.
10075	corpus-6-train	EN	I've lost one of my contact lenses.
10078	corpus-6-test-corpus-26-train	EN	Do you know a good dentist?
10081	corpus-6-train	EN	Say, Adrian, you don't think this robe here is too baggy, you know?
10084	corpus-6-test-corpus-26-train	EN	Oh. You should notify the consulate right away.
10090	corpus-6-train	EN	This is for her.
10091	corpus-6-test-corpus-26-train	EN	Shaken, not stirred.
10093	corpus-6-train	EN	Is this the right gate for going to Paris?
10095	corpus-6-train	EN	Show me it on this map.
10096	corpus-6-train	EN	I hear there are some good jazz clubs.
10098	corpus-6-test-corpus-26-dev	EN	Would you like a table in the main restaurant or in a private room, sir?
10099	corpus-6-train	EN	Which stop is closest to Lincoln Center?
10101	corpus-6-train	EN	What's the latest check-in time for this flight at the airport?
10102	corpus-6-test-corpus-26-train	EN	A large number of people go to the beach during the season.
10104	corpus-6-train	EN	Do you know the name of the elegant lady dancing with Mr. Cole?
10105	corpus-6-train	EN	I love you. You belong to me.
10107	corpus-6-test-corpus-26-train	EN	I weigh about one hundred and fifty pounds.
10109	corpus-6-train	EN	I'd like to have a subway map.
10110	corpus-6-train	EN	I'd like to buy six neckties. Could you give me a discount?
10111	corpus-6-test-corpus-26-train	EN	Where should I transfer?
10112	corpus-6-train	EN	Oh, I guess they call you Cal.
10113	corpus-6-train	EN	I'll carry my umbrella just in case.
10114	corpus-6-test-corpus-26-train	EN	Where is the lost property office?
10116	corpus-6-test-corpus-26-train	EN	Is there any bus that goes there directly?
10118	corpus-6-train	EN	What platform does the limited express for Washington depart from?
10120	corpus-6-train	EN	Is that a flower shop next to our hotel?
10121	corpus-6-train	EN	I'm looking for running shoes.
10122	corpus-6-train	EN	Do you have make-up kits?
10123	corpus-6-train	EN	Which track does this train leave from?
10124	corpus-6-train	EN	I don't need this much. I just want one.
10125	corpus-6-test-corpus-26-train	EN	Do I need any special treatment?
10129	corpus-6-test-corpus-26-train	EN	Will that be cash or charge?
10130	corpus-6-train	EN	Was Mr. Jones serious when he said he was retiring soon?
10133	corpus-6-train	EN	I have a cold.
10134	corpus-6-test-corpus-26-test	EN	We moved to this house a year ago.
10137	corpus-6-train	EN	"Do you know the Chinese restaurant named ""Dragon"" around there?"
10139	corpus-6-train	EN	Call an ambulance quickly.
10140	corpus-6-train	EN	Here's a sample package. Is this okay with you?
10144	corpus-6-train	EN	Now, I'd like to make a reservation again.
10145	corpus-6-train	EN	All together. Discount, please.
10147	corpus-6-dev	EN	Please change the bulb.
10148	corpus-6-train	EN	It's over there.
10149	corpus-6-train	EN	Are there any letters in the package? What's in it?
10151	corpus-6-dev	EN	Yes, you can. The room is ready. Please write your name and address here.
10152	corpus-6-train	EN	Where is the place?
10154	corpus-6-train	EN	How long are my feet?
10155	corpus-6-test-corpus-26-train	EN	How long will it take to get my visa issued?
10156	corpus-6-test-corpus-26-train	EN	Where are the restrooms?
10158	corpus-6-dev	EN	It's nothing serious.
10159	corpus-6-dev	EN	Do I need a fishing license?
10160	corpus-6-test-corpus-26-train	EN	The total amount due is two hundred forty-three pounds, ma'am.
10161	corpus-6-train	EN	If my credit card is used, could you compensate the amount?
10164	corpus-6-test-corpus-26-train	EN	This is a present. Could you wrap it in some pretty wrapping paper?
10166	corpus-6-train	EN	Don't open any of my mail.
10167	corpus-6-train	EN	The fourth block past the Starbucks coffee.
10168	corpus-6-train	EN	I'm looking for something formal.
10169	corpus-6-train	EN	Can the battery be changed?
10172	corpus-6-train	EN	Can you hang up my jacket, please?
10173	corpus-6-train	EN	The food on the next table looks good.
10174	corpus-6-train	EN	Does it have a large trunk?
10180	corpus-6-train	EN	Can I look after him?
10181	corpus-6-train	EN	That's too bad. Please take good care of yourself.
10182	corpus-6-test-corpus-26-train	EN	What a view. These are great trails.
10185	corpus-6-train	EN	Here comes the hot dog man.
10187	corpus-6-test-corpus-26-dev	EN	There are people injured.
10191	corpus-6-test-corpus-26-dev	EN	Excuse me. Where is the station around here?
10192	corpus-6-train	EN	I'd like a strong coffee.
10195	corpus-6-train	EN	I have health insurance.
10196	corpus-6-train	EN	Are you married or single?
10197	corpus-6-train	EN	Please call a taxi for me. I want to go back to the hotel.
10201	corpus-6-dev	EN	How much must I pay per hour?
10203	corpus-6-train	EN	The advantage of the gallery is that we can see the whole stage.
10205	corpus-6-train	EN	This leather?
10206	corpus-6-dev	EN	What time is check-in?
10207	corpus-6-train	EN	There was a big earthquake this morning.
10212	corpus-6-train	EN	Break this one dollar into small change, please.
10213	corpus-6-train	EN	Nine three nine six seven zero zero.
10214	corpus-6-train	EN	They were two young man.
10216	corpus-6-train	EN	This is wine we like very much. I hope you'll enjoy it.
10223	corpus-6-train	EN	Is there an afternoon tour?
10224	corpus-6-test-corpus-26-train	EN	Yes, we have a reservation for you.
10226	corpus-6-train	EN	It's fried alligator meat. It's very delicious, a little crunchy.
10227	corpus-6-dev	EN	I would like to eat a lobster raw.
10228	corpus-6-dev	EN	Please bring my breakfast at seven.
10230	corpus-6-train	EN	May I have some medicine for headache?
10231	corpus-6-train	EN	One person will check out tomorrow.
10232	corpus-6-train	EN	It's ninety-nine dollars with tax a night.
10235	corpus-6-train	EN	My name tag is on the bag.
10238	corpus-6-test-corpus-26-train	EN	Excuse me, but I want to go to my hotel in the city by bus. Where can I take a bus?
10239	corpus-6-train	EN	Will this work on one hundred volts?
10243	corpus-6-test-corpus-26-test	EN	Chicken, please.
10244	corpus-6-train	EN	Do you know what the prescription is for your lenses?
10246	corpus-6-train	EN	Do I have to change buses to get to the Lincoln Center?
10249	corpus-6-train	EN	I'd like some vitamins.
10250	corpus-6-train	EN	Please wait. I'll check if one is available.
10251	corpus-6-train	EN	Please check the tires.
10254	corpus-6-train	EN	May I recline the seat?
10255	corpus-6-train	EN	In spring, cherry blossoms in the precincts of some Buddhist temples are very attractive, while in autumn the colored leaves at Arashiyama offer a fascinating sight coupled with the pure air and the clear river.
10256	corpus-6-train	EN	Where is it located?
10257	corpus-6-test-corpus-26-train	EN	This is room two o one. I'd like to order breakfast tomorrow.
10259	corpus-6-train	EN	What holidays do you have in Japan?
10264	corpus-6-train	EN	I feel uncomfortable. Please fix it as soon as possible.
10265	corpus-6-dev	EN	I'll send you this picture. Your name and address, please.
10268	corpus-6-train	EN	Please call me Midori.
10271	corpus-6-dev	EN	I'll study science in a university.
10272	corpus-6-test-corpus-26-test	EN	What do you think about sexual harassment in the work place?
10273	corpus-6-train	EN	Will this all be on the same tab?
10277	corpus-6-train	EN	Robber.
10278	corpus-6-train	EN	What color do you like?
10279	corpus-6-train	EN	Thanks. How late can I still get room service?
10280	corpus-6-train	EN	I need some shoe polish.
10281	corpus-6-train	EN	My throat's sore.
10283	corpus-6-train	EN	Where can I find the music guide?
10284	corpus-6-dev	EN	I'm sorry I'm late.
10285	corpus-6-train	EN	Please cut my bangs one inch above the eyebrows.
10286	corpus-6-train	EN	Where's the baggage claim?
10287	corpus-6-train	EN	Can you give me a prescription?
10288	corpus-6-train	EN	I'd like a seat for today.
10290	corpus-6-train	EN	I'd like some fruit juice, please.
10293	corpus-6-train	EN	We'll have to make the best of the thing.
10294	corpus-6-train	EN	I'd like to reserve a seat to Boston. Can I get a seat on today's three thirty p.m.?
10295	corpus-6-train	EN	I want to reserve a seat to Seattle.
10296	corpus-6-train	EN	We have a different sense of values.
10297	corpus-6-dev	EN	To begin with, I must say that I'm not a specialist on this matter, or do I represent any government organization. What I'm going to tell you is entirely my own personal views. With that qualification I'm willing to voice my view.
10298	corpus-6-train	EN	Let's give you a blood test.
10299	corpus-6-dev	EN	I lost them yesterday afternoon.
10301	corpus-6-train	EN	Let's eat a simple lunch.
10303	corpus-6-train	EN	What kind of lipstick do you have?
10304	corpus-6-train	EN	What time will the next train to Philadelphia leave?
10305	corpus-6-train	EN	Not too short. Just a good trim.
10306	corpus-6-dev	EN	I'd like to make an overseas call. Please connect me to three four six three eight one three three in Tokyo.
10307	corpus-6-train	EN	This fish is a bit overcooked.
10308	corpus-6-train	EN	Unfortunately, no. It requires something with a little more kick.
10309	corpus-6-train	EN	Change this into dollars, please.
10312	corpus-6-train	EN	I am not from here.
10313	corpus-6-train	EN	Would you like to take a look at this pamphlet?
10315	corpus-6-train	EN	A rolling stone gathers no moss.
10318	corpus-6-test-corpus-26-dev	EN	I have two sisters.
10319	corpus-6-train	EN	You told me the fare was ten dollars at the airport.
10321	corpus-6-train	EN	Please take me to the theater.
10327	corpus-6-dev	EN	Round trip, please.
10329	corpus-6-train	EN	It shouldn't be that much.
10332	corpus-6-train	EN	Want to see a movie or something?
10333	corpus-6-train	EN	That's not my fault.
10335	corpus-6-train	EN	No, I don't. May I see another one?
10336	corpus-6-test-corpus-26-dev	EN	Flight number two zero eight, to Tokyo.
10337	corpus-6-train	EN	I want to check out.
10339	corpus-6-train	EN	How long will it last?
10341	corpus-6-dev	EN	How long does it take to get to Soho on foot?
10342	corpus-6-train	EN	Where shall we deliver your baggage when we recover it?
10346	corpus-6-train	EN	There's one across the street.
10348	corpus-6-train	EN	Fifteen dollars for the diagnoses. I'll give you the prescription.
10349	corpus-6-train	EN	Do you have a fax service?
10350	corpus-6-dev	EN	Which is colder in winter, Japan or Australia?
10351	corpus-6-train	EN	How much is one?
10352	corpus-6-train	EN	Four doors is fine.
10354	corpus-6-test-corpus-26-train	EN	Then let's put a padding inside.
10355	corpus-6-train	EN	No, thank you. I'd like the check, please.
10356	corpus-6-train	EN	I'm a trainee.
10357	corpus-6-train	EN	Just because it's a discount ticket, that can't be.
10358	corpus-6-train	EN	I'd like a novel in some not-too-difficult English.
10359	corpus-6-train	EN	It'd be a drag to catch a disease, so I won't go there.
10361	corpus-6-train	EN	Do you have your receipt?
10362	corpus-6-train	EN	I think there is a mistake in this bill.
10363	corpus-6-dev	EN	Something urgent came up and he couldn't make it.
10366	corpus-6-test-corpus-26-test	EN	Let's get together to discuss this further.
10367	corpus-6-train	EN	Excuse me, would you exchange this?
10368	corpus-6-train	EN	We'll need to book you on another flight.
10369	corpus-6-dev	EN	Is this one hundred percent pure leather?
10370	corpus-6-train	EN	I was in a car accident at Ocean Boulevard and twelfth Street.
10372	corpus-6-test-corpus-26-train	EN	How would you like your hair done today?
10373	corpus-6-train	EN	What are the hours for breakfast?
10374	corpus-6-train	EN	Change over to a local train at Phoenix.
10375	corpus-6-train	EN	Will it be nice day?
10377	corpus-6-train	EN	I'd like to mail a post card. Can I have a stamp?
10380	corpus-6-train	EN	I have gone diving about ten times.
10384	corpus-6-train	EN	We'd like a poolside room.
10386	corpus-6-train	EN	Can you send it to Japan?
10390	corpus-6-train	EN	You look tired.
10392	corpus-6-train	EN	He was born in nineteen sixty.
10393	corpus-6-train	EN	I'm afraid the sleeves are too long.
10394	corpus-6-train	EN	Sorry, I can't.
10396	corpus-6-train	EN	I want to go to Boston.
10398	corpus-6-train	EN	Do you have an Aramis cologne for a sensitive skin?
10401	corpus-6-train	EN	Give me some more bread, please.
10403	corpus-6-test-corpus-26-train	EN	Could you say it in other words?
10407	corpus-6-train	EN	Give me time to think it over.
10408	corpus-6-test-corpus-26-train	EN	I'll make do with whatever you have.
10409	corpus-6-train	EN	They are not counter-signed.
10411	corpus-6-test-corpus-26-train	EN	We'd like a table near the stage.
10412	corpus-6-train	EN	May I have some jam?
10413	corpus-6-train	EN	How about this one? This is just one hundred dollars. It's worth every penny of it.
10414	corpus-6-dev	EN	Can we have a meal?
10416	corpus-6-test-corpus-26-train	EN	I'm fine. Well, are you going somewhere?
10417	corpus-6-train	EN	I'd like a pair of suede shoes.
10419	corpus-6-train	EN	In the morning yes, but in the afternoon it'll get cloudy.
10421	corpus-6-train	EN	Do we need to have a reservation in advance?
10422	corpus-6-train	EN	Keep the line open, please.
10424	corpus-6-train	EN	I wouldn't count on it.
10425	corpus-6-train	EN	Dinner won't be served until seven. Now only drinks are available.
10426	corpus-6-train	EN	Say it again?
10427	corpus-6-train	EN	I'm going to sleep. Will you bring my meal later on?
10431	corpus-6-train	EN	We celebrate having a new year after the old year passed safely.
10433	corpus-6-test-corpus-26-train	EN	It is two thousand four hundred meters high.
10434	corpus-6-train	EN	Is there a police office near here?
10435	corpus-6-test-corpus-26-train	EN	Come in. Please put it on the table there.
10438	corpus-6-train	EN	My blue jacket is missing.
10440	corpus-6-test-corpus-26-train	EN	Please cancel my card number.
10441	corpus-6-train	EN	Pay me.
10442	corpus-6-dev	EN	I'll take you there.
10446	corpus-6-train	EN	Do you know of a pharmacy that carries Japanese medicine?
10448	corpus-6-train	EN	There is a good record shop around the corner.
10452	corpus-6-train	EN	I'm here on vacation.
10453	corpus-6-train	EN	No, I don't enjoy watching other people play. I like to play myself.
10454	corpus-6-train	EN	That's not possible.
10455	corpus-6-train	EN	Roll up your sleeve, please.
10456	corpus-6-train	EN	We can't do it here.
10457	corpus-6-train	EN	Which corner to turn?
10458	corpus-6-dev	EN	I'm sure I gave you a fifty-dollar bill.
10459	corpus-6-train	EN	We can't change coins.
10460	corpus-6-train	EN	Please call Chicago, eight seven seven six five o seven.
10463	corpus-6-train	EN	Turn left at the blinking signal.
10466	corpus-6-train	EN	Where's the nearest dressmaker?
10468	corpus-6-test-corpus-26-train	EN	I'm sorry, they're all sold out, but we'll have them in a few days.
10469	corpus-6-train	EN	Can I have a popcorn, please?
10472	corpus-6-train	EN	Two first class tickets, please.
10473	corpus-6-test-corpus-26-test	EN	Could I have some coffee?
10474	corpus-6-train	EN	The bus will bring you back here at six.
10475	corpus-6-train	EN	Where is this?
10477	corpus-6-test-corpus-26-train	EN	I don't have an appointment, but it's urgent.
10479	corpus-6-test-corpus-26-train	EN	This is poorly made.
10480	corpus-6-test-corpus-26-train	EN	Where's the escalator?
10482	corpus-6-train	EN	I would like someplace fancy.
10483	corpus-6-train	EN	No, can't you sell it for this much?
10484	corpus-6-train	EN	Can I find it easily?
10485	corpus-6-train	EN	We can get various kinds of imported brand products.
10487	corpus-6-train	EN	Where can I play roulette?
10489	corpus-6-train	EN	Do you have a safe-deposit box?
10490	corpus-6-dev	EN	I'm glad you did. Please give my warmest wishes to your family.
10491	corpus-6-train	EN	Please call a taxi at ten in the morning.
10492	corpus-6-dev	EN	I'd like to, but I'm afraid I really have to go. I may miss the last train. I enjoyed talking to you.
10493	corpus-6-train	EN	I wonder how they make it?
10495	corpus-6-train	EN	Skin care items for dry skin, please.
10496	corpus-6-train	EN	Please deposit seventy-five cents for an additional three minutes.
10497	corpus-6-test-corpus-26-train	EN	Do you have a brochure to events?
10500	corpus-6-test-corpus-26-train	EN	Where is the entrance to the subway?
10502	corpus-6-train	EN	Please tell me the charge after the call.
10503	corpus-6-train	EN	Do I need formal attire?
10504	corpus-6-test-corpus-26-train	EN	I lost my airline ticket.
10505	corpus-6-train	EN	Just looking. Thank you.
10506	corpus-6-train	EN	What is the opening hour at this botanical garden?
10508	corpus-6-dev	EN	Excuse me, but I'm lost. Where is the exit?
10516	corpus-6-train	EN	Would you like me to tell you?
10518	corpus-6-train	EN	Here's to you.
10519	corpus-6-train	EN	Have you ever been to New York?
10520	corpus-6-train	EN	These are personal effects.
10522	corpus-6-train	EN	What fabric is it?
10523	corpus-6-train	EN	What is boarding time?
10524	corpus-6-train	EN	Take the N Line Express to Canal Street. Then change to the R Line.
10525	corpus-6-train	EN	I am a teacher.
10527	corpus-6-train	EN	I have an M.S. from Kyoto University.
10533	corpus-6-train	EN	Give me fifteen gallons of two star petrol, please.
10534	corpus-6-train	EN	I was surrounded by kids and they got ice cream on my clothes. After that my wallet was gone.
10535	corpus-6-train	EN	The actor is really fantastic.
10536	corpus-6-train	EN	Here's my Green Card.
10537	corpus-6-train	EN	Where's the lifeguard?
10539	corpus-6-train	EN	I see. Thank you very much.
10540	corpus-6-dev	EN	In years past, it was a day to celebrate the rice harvest.
10543	corpus-6-train	EN	Well, I'd like you to type this report.
10550	corpus-6-train	EN	Do you have something light?
10551	corpus-6-train	EN	Here, I'd like it taken in five centimeters.
10553	corpus-6-train	EN	I'd like to reserve a private room in the sleeping car.
10555	corpus-6-train	EN	We have a large selection of desserts, including cakes and ice cream.
10556	corpus-6-train	EN	No, thanks. Just tell him that I called and I'll call again later this afternoon.
10559	corpus-6-test-corpus-26-train	EN	Can't you stay here during the vacation?
10560	corpus-6-train	EN	Do you have a road map that I can have?
10562	corpus-6-test-corpus-26-train	EN	Oh, I'm so sorry to have bothered you.
10563	corpus-6-test-corpus-26-dev	EN	Can you book events?
10564	corpus-6-train	EN	It's hot. Can you do something?
10565	corpus-6-test-corpus-26-train	EN	Is there a public rest room near here?
10566	corpus-6-train	EN	What's the name of that plant?
10567	corpus-6-train	EN	Shit.
