sentID.BTEC	split	lang	sent
5281	corpus-6-train	EN	Can I go on foot?
5282	corpus-6-train	EN	I'll come back later.
5284	corpus-6-train	EN	Yes. Terayama. And put me as close as possible to the stage, please.
5285	corpus-6-train	EN	Can you think of what I should say to him?
5287	corpus-6-train	EN	Is a bathroom nearby?
5289	corpus-6-test-corpus-26-train	EN	I am the same age.
5291	corpus-6-train	EN	It's been a wonderful evening, thank you.
5293	corpus-6-train	EN	May I move to another vacant seat? I can't see the movie screen very well from my seat.
5296	corpus-6-train	EN	The smoke-detector is on.
5298	corpus-6-train	EN	I'd like to take the San Francisco Bay excursion cruise.
5299	corpus-6-train	EN	Have you any idea where you are going?
5300	corpus-6-test-corpus-26-train	EN	Will you bring me some coffee?
5301	corpus-6-train	EN	No. Pay the driver.
5302	corpus-6-train	EN	What are the store's hours?
5303	corpus-6-train	EN	We would like a table in the corner.
5305	corpus-6-train	EN	I'm not sure, but I can't stand the smell of meat. All I want to eat are pickles.
5307	corpus-6-test-corpus-26-dev	EN	Three hundred fifty dollars? That's over my budget.
5308	corpus-6-train	EN	I think this is added up wrong.
5310	corpus-6-train	EN	I'd like to go skiing for about a week. Do you have any ski package tours?
5311	corpus-6-train	EN	They're playing two Mozart symphonies.
5312	corpus-6-train	EN	We'll keep looking and when we find it, we'll let you know.
5314	corpus-6-train	EN	Today's weather is really nice.
5315	corpus-6-train	EN	Two adults and two children age under twelve, please.
5316	corpus-6-train	EN	Please explain to my satisfaction.
5317	corpus-6-train	EN	I'd like a disc film for this camera, please.
5321	corpus-6-train	EN	We have no national holidays associated with religions.
5322	corpus-6-train	EN	How much luggage can I carry on?
5323	corpus-6-test-corpus-26-train	EN	Do we need to put this to a vote? If not, I think we've arrived at a conclusion, which I'll send to our board of directors tomorrow morning.
5325	corpus-6-train	EN	But it doesn't work.
5328	corpus-6-train	EN	Could I see that bag, please?
5330	corpus-6-train	EN	Wow, I'm lucky. This isn't even playing in Japan yet.
5331	corpus-6-train	EN	I paid three hundred twenty dollars at the duty-free shop.
5332	corpus-6-train	EN	Could you reach that pen under the chair?
5333	corpus-6-train	EN	I will pay for my friends, too.
5334	corpus-6-test-corpus-26-train	EN	Do you know if there are any cheap hotels?
5335	corpus-6-train	EN	It took me for five years to come here.
5337	corpus-6-train	EN	How much is the Japanese yen worth against the US dollar?
5338	corpus-6-train	EN	Can I have a half pound of shrimp salad?
5339	corpus-6-train	EN	Is there a coffee shop or restaurant in the building?
5340	corpus-6-train	EN	Oh, it's too expensive.
5344	corpus-6-train	EN	The express train is at number eight platform.
5347	corpus-6-train	EN	I'm in a hurry now.
5348	corpus-6-train	EN	Fuck off.
5349	corpus-6-train	EN	This is Suzuki speaking.
5350	corpus-6-train	EN	My wrist watch has been misplaced while I was out.
5351	corpus-6-dev	EN	How long will it take by bus?
5354	corpus-6-train	EN	Okay. We've reserved your hotel room.
5356	corpus-6-train	EN	The drain is stopped up with dust.
5358	corpus-6-train	EN	Well, I think I should be on my way.
5359	corpus-6-train	EN	Hey, I'm on my way to pick you up, so let's meet in about fifteen minutes.
5361	corpus-6-test-corpus-26-train	EN	Good morning. Did you sleep well?
5362	corpus-6-train	EN	Have you already made a reservation?
5364	corpus-6-test-corpus-26-train	EN	What do you intend to do after you finish school?
5366	corpus-6-test-corpus-26-train	EN	I was robbed of my shoulder bag on the street.
5367	corpus-6-test-corpus-26-train	EN	Did you have any other services besides breakfast this morning?
5369	corpus-6-train	EN	I'll take a short trip to Mexico.
5370	corpus-6-train	EN	Which floor is ladies' wear on?
5371	corpus-6-train	EN	Can I have a transfer ticket?
5373	corpus-6-train	EN	The strings are worn out.
5374	corpus-6-train	EN	Why is the service so slow?
5377	corpus-6-train	EN	Look down there.
5378	corpus-6-dev	EN	They are so many that I don't know which one to choose.
5379	corpus-6-train	EN	How do I make a telephone call?
5381	corpus-6-dev	EN	No. I'm interested in jeans and pants suits.
5382	corpus-6-train	EN	We have different sizes.
5386	corpus-6-train	EN	I took the wrong bus. Could I have a transfer?
5387	corpus-6-train	EN	I don't know.
5388	corpus-6-train	EN	Where can I catch the bus bound for Beverly Hills?
5392	corpus-6-train	EN	Let's meet in my room.
5393	corpus-6-train	EN	Do you have any sedative?
5395	corpus-6-train	EN	What other companies do well?
5397	corpus-6-train	EN	Talk the talk and walk the walk.
5399	corpus-6-train	EN	Are there any sightseeing buses?
5400	corpus-6-train	EN	Please exclude abalone from our order. It's very expensive.
5402	corpus-6-train	EN	Then I'll pay you three hundred dollars in traveler's checks.
5406	corpus-6-train	EN	Phyllis burst into tears at the news.
5407	corpus-6-test-corpus-26-train	EN	I'd like a cup of white coffee, please.
5408	corpus-6-train	EN	I'll visit New York, Chicago, New Orleans and Los Angeles.
5409	corpus-6-train	EN	Where is the pharmacy?
5410	corpus-6-test-corpus-26-test	EN	Okay. Is the Sheraton Hotel around there?
5411	corpus-6-test-corpus-26-train	EN	I hope you're not too tired.
5413	corpus-6-train	EN	Show me your boarding card.
5414	corpus-6-train	EN	Please don't pull my leg.
5415	corpus-6-train	EN	Oh, I'm not sure I agree to that way of thinking.
5417	corpus-6-train	EN	Just hot water.
5418	corpus-6-train	EN	That'll be fine. Can I see it, please?
5419	corpus-6-train	EN	I would like some peanuts, please.
5421	corpus-6-train	EN	You'll be going on April twentieth, and coming back on April twenty-first. Is that correct?
5422	corpus-6-train	EN	Will you exchange American dollars into British pounds?
5425	corpus-6-train	EN	Would you like meat or chicken?
5427	corpus-6-train	EN	I'd like to have some Chinese food for dinner.
5430	corpus-6-train	EN	Can you recommend a good hotel?
5431	corpus-6-test-corpus-26-train	EN	I'd like to rent a car of this class for two days.
5433	corpus-6-train	EN	Waiter, would you bring the check, please?
5434	corpus-6-train	EN	Do come to see us again, please.
5435	corpus-6-train	EN	I have a slight fever. Do you have something good for it?
5436	corpus-6-test-corpus-26-train	EN	I'll take a shot of Jack Daniels.
5437	corpus-6-test-corpus-26-train	EN	I'd like a bag of popcorn, please.
5438	corpus-6-train	EN	"One ticket for ""Bird"" , please."
5439	corpus-6-train	EN	That's right. They look like full-grown natural trees. People enjoy the scenery they produce.
5441	corpus-6-train	EN	I'll introduce you to my family doctor.
5442	corpus-6-train	EN	I've never been to such a beautiful place like Boston.
5444	corpus-6-train	EN	I left something in the room. May I go back and check?
5446	corpus-6-train	EN	May I pay by traveler's checks?
5447	corpus-6-test-corpus-26-train	EN	I dropped a ski pole.
5448	corpus-6-train	EN	I can't believe the passenger lobby is non-smoking. What a pain.
5450	corpus-6-dev	EN	I want to rent a compact car.
5451	corpus-6-train	EN	This room is too cold.
5452	corpus-6-train	EN	May I have a map of the slopes?
5455	corpus-6-test-corpus-26-train	EN	We don't bring any presents to the reception. Instead, the guests bring cash.
5456	corpus-6-dev	EN	Will you step over here to this showcase?
5458	corpus-6-test-corpus-26-train	EN	I'd like to send it by surface mail.
5461	corpus-6-train	EN	Could you show me where I can exchange money?
5464	corpus-6-train	EN	If you could lower the price a little more, I'll buy it.
5467	corpus-6-dev	EN	You put too much salt in it.
5470	corpus-6-train	EN	You are my angel. Thank you very much.
5471	corpus-6-train	EN	To fifty dollars?
5472	corpus-6-train	EN	The dining room is on the first floor and opens at five thirty p.m.
5473	corpus-6-train	EN	Excuse me. Could you tell me how to get to the Fairmont Hotel?
5476	corpus-6-dev	EN	How many containers of milk do you buy every week?
5477	corpus-6-train	EN	Is this taxi available?
5478	corpus-6-train	EN	In America, what is the number to dial for international calls?
5480	corpus-6-dev	EN	Will you explain it again?
5481	corpus-6-train	EN	What are the business hours of the bank?
5484	corpus-6-train	EN	Could you change my flight date from London to Tokyo?
5486	corpus-6-train	EN	I need another three dollars.
5489	corpus-6-train	EN	Where, Lost and Found, please.
5491	corpus-6-train	EN	We want to have fun playing sports unique to the West Coast.
5492	corpus-6-test-corpus-26-train	EN	The plane arrived late due to a heavy snow.
5495	corpus-6-train	EN	Can I just pay the difference from the ticket I have?
5496	corpus-6-train	EN	Yes, I am. Why do you ask?
5499	corpus-6-train	EN	By registered mail, please.
5500	corpus-6-train	EN	The main diet in Japan is rice.
5501	corpus-6-train	EN	We need to cut down a budget.
5502	corpus-6-train	EN	Yes, We'd like a bottle of red wine.
5503	corpus-6-train	EN	Uh, no. It's all right. Is that all you got? Okay.
5504	corpus-6-train	EN	We'd like a table near the window.
5505	corpus-6-train	EN	To go to a conference.
5507	corpus-6-train	EN	This is room eleven o two. Could you bring me some beers?
5508	corpus-6-dev	EN	Oh, that's nice. I will try that.
5511	corpus-6-train	EN	Well, of course there are fine restaurants. Some people eat at the pushcarts, some people take their lunch to the office. Basically, we don't spend much time with lunch.
5512	corpus-6-train	EN	Let's move on to the next subject.
5513	corpus-6-train	EN	Maybe the raw food for lunch was bad.
5514	corpus-6-dev	EN	Would you give her some medicine for airsickness, please?
5517	corpus-6-dev	EN	I can't explain my condition in English.
5518	corpus-6-test-corpus-26-train	EN	Charge, please.
5519	corpus-6-train	EN	Just fun.
5521	corpus-6-test-corpus-26-train	EN	Would you take a message, please?
5526	corpus-6-train	EN	Did you use the fridge?
5527	corpus-6-train	EN	May I have my baggage back?
5528	corpus-6-train	EN	There was blood in my stool.
5530	corpus-6-train	EN	Sorry, but I can't go along with you.
5531	corpus-6-train	EN	And I want you to join us, if you don't mind.
5534	corpus-6-train	EN	Can I help you, madam?
5535	corpus-6-train	EN	Yes, in the dining room and grill.
5536	corpus-6-train	EN	My name is Yukio Oka, flight one two five for Narita on August fourteenth.
5538	corpus-6-train	EN	I'd like to get a souvenir for my son.
5539	corpus-6-train	EN	They must be real rich in spite of how they look. Still, they beat the price.
5540	corpus-6-test-corpus-26-train	EN	Sorry, I can't follow you. Would you speak a little more slowly, please?
5541	corpus-6-train	EN	Two dollars to one pound. Is that all right?
5542	corpus-6-train	EN	Ichiro Suzuki. S-U-Z-U-K-I.
5543	corpus-6-train	EN	Can someone else help you with this matter?
5546	corpus-6-train	EN	Well, before leaving, would you mind telling me what impressions you have of Japan?
5547	corpus-6-train	EN	Excuse me. Could you tell me when my photos will be ready?
5548	corpus-6-train	EN	I have Marvin Dorfler on the line. Shall I put him through?
5549	corpus-6-test-corpus-26-dev	EN	What can I show you?
5551	corpus-6-train	EN	I gave you a one hundred dollar bill.
5553	corpus-6-train	EN	What do you think of this problem, George? Could you expand on the point for the class?
5555	corpus-6-train	EN	In that case, you don't have to fill one out.
5556	corpus-6-train	EN	Is it all right to unfasten my seat belt?
5557	corpus-6-train	EN	I'm from Colorado. What part of Japan are you from?
5558	corpus-6-train	EN	It sure is. We were pretty busy yesterday, but today the place is dead. When does your plane leave?
5559	corpus-6-test-corpus-26-train	EN	May I take pictures?
5562	corpus-6-train	EN	I've paid cash on the spot.
5563	corpus-6-train	EN	Please call the manager.
5564	corpus-6-train	EN	Where shall we meet?
5565	corpus-6-train	EN	Say it again, please.
5567	corpus-6-train	EN	I'd like a card game.
5569	corpus-6-train	EN	How much is the postage to Japan?
5570	corpus-6-test-corpus-26-train	EN	Out of one hundred.
5571	corpus-6-train	EN	My companion has been attacked by asthma.
5572	corpus-6-train	EN	Is supper ready yet? I'm starved . Would you set the table?
5573	corpus-6-train	EN	Could you write out a certificate of theft for me?
5578	corpus-6-train	EN	Please put it in this brown paper bag.
5580	corpus-6-train	EN	I can't decide.
5581	corpus-6-train	EN	It has been bothering me since I got here.
5582	corpus-6-dev	EN	How do I do it?
5583	corpus-6-train	EN	I lost my wallet and room key at the beach.
5584	corpus-6-test-corpus-26-dev	EN	The flight number is HP eighty-nine for Tokyo on March eleventh.
5585	corpus-6-test-corpus-26-train	EN	Can I have the same dish as that one?
5587	corpus-6-train	EN	Are you here on a honeymoon?
5590	corpus-6-train	EN	To go. Would you put a fork in the bag?
5592	corpus-6-train	EN	Can we camp on your ground?
5593	corpus-6-dev	EN	If something happens, please get in touch with me.
5594	corpus-6-test-corpus-26-dev	EN	Do you have another one?
5595	corpus-6-dev	EN	Mat finish, please.
5596	corpus-6-test-corpus-26-train	EN	Please bring my breakfast to my room at seven tomorrow morning.
5598	corpus-6-train	EN	How often do they run?
5599	corpus-6-train	EN	I want to send this letter by registered mail.
5600	corpus-6-train	EN	My arrival will be thirty minutes late. Please defer my check-in.
5601	corpus-6-train	EN	I'd like them soled and heeled, please.
5603	corpus-6-train	EN	Excuse me. Could you tell me the way to the rail station, please?
5605	corpus-6-train	EN	Don't you think I'll need a guidebook?
5606	corpus-6-train	EN	Can I get to the concert hall by six?
5608	corpus-6-train	EN	Sorry, but we'll have to keep it.
5612	corpus-6-train	EN	I'm looking for eye shadow.
5613	corpus-6-dev	EN	Do I have to order breakfast now?
5615	corpus-6-test-corpus-26-train	EN	A maintenance person will be up shortly.
5617	corpus-6-test-corpus-26-dev	EN	I'm sorry. I'll come back later.
5618	corpus-6-train	EN	I already paid it when I bought my ticket.
5619	corpus-6-train	EN	Yes, you can. But take it easy.
5620	corpus-6-train	EN	When do you start your duty-free sales?
5621	corpus-6-train	EN	Sorry to keep you waiting. I'll go up to your room with you.
5622	corpus-6-train	EN	It's one dollar. You have to have exact change.
5623	corpus-6-train	EN	Your room is on the third floor, number three fifty-seven.
5624	corpus-6-train	EN	There's no hot running water.
5625	corpus-6-train	EN	I'd like an English-Japanese dictionary.
5626	corpus-6-train	EN	Hello, I have a reservation.
5627	corpus-6-train	EN	Please show me your baggage.
5629	corpus-6-train	EN	Bring it quickly, please. I'm in a hurry.
5633	corpus-6-train	EN	But where? You don't know any hair salons around here.
5635	corpus-6-dev	EN	Check this through to final destination, please.
5636	corpus-6-train	EN	Change this into coins, please.
5637	corpus-6-train	EN	I have one carton of cigarettes.
5639	corpus-6-train	EN	Do I need to declare this?
5640	corpus-6-test-corpus-26-test	EN	How can I take it?
5641	corpus-6-train	EN	Are cook books on the second floor, too?
5642	corpus-6-train	EN	There is regular boat service from Kobe to the ports in Shikoku and Kyushu.
5646	corpus-6-train	EN	Please exchange this.
5648	corpus-6-test-corpus-26-train	EN	Are there any vacancies on the Thursday tour?
5649	corpus-6-train	EN	Could you please explain that in more detail?
5651	corpus-6-train	EN	When it's dry, peel it off your face.
5653	corpus-6-train	EN	How long will it take for a haircut?
5654	corpus-6-train	EN	I'd like an address book, please.
5655	corpus-6-train	EN	I'd like to pick up my valuables.
5657	corpus-6-test-corpus-26-train	EN	Excuse me. May I get by?
5658	corpus-6-train	EN	I'd like to sit down now.
5660	corpus-6-train	EN	About one hour after take off. We start the meal service when we are flying level.
5661	corpus-6-train	EN	I have a first class reservation on flight number one one three from Los Angeles to New York on October twenty-fifth.
5663	corpus-6-train	EN	This is valid for fourteen days, so you can use it till the twenty-third.
5666	corpus-6-train	EN	It's not polite to slurp your food.
5667	corpus-6-dev	EN	I spilled soup.
5669	corpus-6-train	EN	I've come to study at a language school.
5671	corpus-6-train	EN	No, excuse me.
5672	corpus-6-train	EN	How much is it to the art museum by taxi?
5675	corpus-6-train	EN	I'm a little early, is it all right?
5680	corpus-6-test-corpus-26-train	EN	Do you have any plants and fruits?
5681	corpus-6-train	EN	Yes, you can see it clearly, because it's fine today.
5684	corpus-6-test-corpus-26-train	EN	Please tell me how to fill out the disembarkation card?
5686	corpus-6-train	EN	Can I reserve a tennis court here?
5687	corpus-6-train	EN	Is there a beauty salon here?
5690	corpus-6-train	EN	What bus should I take to the Skyway Hotel?
5691	corpus-6-train	EN	Then could you show me a major credit card and your driver's license?
5694	corpus-6-dev	EN	No, I don't have that much money.
5695	corpus-6-test-corpus-26-train	EN	I believe my car is worth in the about five thousand dollars.
5696	corpus-6-dev	EN	Yes, I'll have a champagne with the hors d'oeuvres.
5697	corpus-6-train	EN	Isn't there a public phone booth around here anywhere?
5700	corpus-6-train	EN	Take this after each meal three times a day.
5701	corpus-6-train	EN	There's a new pizza shop near here that I'd like to try.
5702	corpus-6-train	EN	"Could you look for ""Anne of Green Gables"" in paperback for me?"
5703	corpus-6-train	EN	Okay. Don't worry. We have a nurse who understands Japanese.
5706	corpus-6-test-corpus-26-train	EN	Is this food low in calories?
5708	corpus-6-train	EN	I'm not satisfied with this.
5709	corpus-6-train	EN	Mr. Ebert has been a great help to me.
5710	corpus-6-train	EN	It's rayon, so it's washable.
5712	corpus-6-train	EN	I've got a cold.
5716	corpus-6-train	EN	Please explain in easier words.
5717	corpus-6-test-corpus-26-train	EN	Which bus should I take to go to the station?
5718	corpus-6-train	EN	I'd like to change my order, if possible.
5722	corpus-6-dev	EN	Let me check with our other store to see if they have it in stock.
5723	corpus-6-test-corpus-26-train	EN	Yes, it is. But you have to turn left at the third traffic light and stay on that street until you come to route sixty-six.
5724	corpus-6-train	EN	Where can I find a limousine?
5725	corpus-6-train	EN	I'd like to file a police report.
5727	corpus-6-train	EN	Six nights beginning July twenty-third. Is it okay?
5728	corpus-6-dev	EN	What time is high tide?
5729	corpus-6-train	EN	My bags are very heavy. Can you help me?
5730	corpus-6-train	EN	Can I drop it off in Seattle?
5733	corpus-6-test-corpus-26-dev	EN	I'd like a glass of water to take some medicine, please.
5734	corpus-6-train	EN	Show me another one, please.
5736	corpus-6-train	EN	May I have a pillow?
5740	corpus-6-train	EN	I'd like to go fishing. Is there a good spot nearby?
5745	corpus-6-dev	EN	To do research in American history at Harvard University.
5749	corpus-6-train	EN	I better not buy bulky things.
5750	corpus-6-train	EN	Could you bring me some pepper, please?
5751	corpus-6-train	EN	Fine weather, isn't it?
5755	corpus-6-train	EN	How can I get tickets for a Broadway show?
5756	corpus-6-train	EN	Where can I find my baggage?
5759	corpus-6-dev	EN	I'm looking for a scarf for my mother. She's in her sixties.
5761	corpus-6-test-corpus-26-train	EN	I would be much obliged if you take me to the beach.
5763	corpus-6-train	EN	I'll take ten percent off the price.
5764	corpus-6-dev	EN	Do you work here?
5766	corpus-6-dev	EN	I'd like to pay for the call.
5767	corpus-6-train	EN	How can I notify the driver when I want to get off the bus?
5772	corpus-6-test-corpus-26-train	EN	I'm sorry. You have the wrong number. This is Tankyusha Press.
5774	corpus-6-train	EN	Could I reserve two single rooms instead of a twin room?
5775	corpus-6-train	EN	It comes to five dollars and thirty cents.
5776	corpus-6-train	EN	I'm transferring at Los Angeles. Are we arriving on time?
5777	corpus-6-train	EN	I am connecting with AF one two three.
5779	corpus-6-test-corpus-26-train	EN	We're checking out.
5780	corpus-6-train	EN	May I have a glass of water?
5781	corpus-6-train	EN	It takes about thirty minutes.
5782	corpus-6-train	EN	Which way is it to Mr. Mason's office?
5783	corpus-6-train	EN	One hundred dollars in cash and my credit card.
5785	corpus-6-train	EN	How much are they each?
5786	corpus-6-train	EN	The currency markets are unstable.
5787	corpus-6-train	EN	I'm planning to drive around Provence tomorrow.
5788	corpus-6-train	EN	I want to charter a boat for one day.
5789	corpus-6-train	EN	It is about forty feet to the cup.
5790	corpus-6-train	EN	It looks a bit underdone.
5791	corpus-6-train	EN	I'll pay in cash, but let me read it, please. What's this charge for?
5792	corpus-6-train	EN	Is it sweet?
5795	corpus-6-dev	EN	What? We just had a meal and now they're bringing another one.
5796	corpus-6-train	EN	It will take at least ninety-nine hours.
5798	corpus-6-train	EN	He sometimes stops by to see us.
5801	corpus-6-train	EN	Where's the mirror?
5802	corpus-6-train	EN	How do I open the hood?
5803	corpus-6-train	EN	I left something in the room.
5804	corpus-6-train	EN	I'd like some liver sausage, please.
5805	corpus-6-train	EN	Use the vending machine.
5807	corpus-6-train	EN	Haircut and shampoo, please.
5808	corpus-6-train	EN	I want to rent some clubs.
5809	corpus-6-train	EN	How many hours are there left before we start?
5810	corpus-6-dev	EN	You're reconfirmed.
5813	corpus-6-train	EN	Please take this to the taxi stand.
5814	corpus-6-train	EN	What is the total percentage of all applicable taxes?
5816	corpus-6-train	EN	It's been such a long time since I've seen you.
5818	corpus-6-train	EN	Reservation for the golf course, please.
5822	corpus-6-train	EN	I'll endure a few inconveniences.
5823	corpus-6-train	EN	Please put some highlights in my hair.
5830	corpus-6-test-corpus-26-dev	EN	What's this music?
5832	corpus-6-train	EN	Can you lend me a jack?
5834	corpus-6-train	EN	We have a nurse who understands Japanese.
5838	corpus-6-train	EN	Do you have medicine for a runny nose?
5840	corpus-6-dev	EN	Could you take me to a hospital?
5842	corpus-6-train	EN	No, I have nothing to declare.
5843	corpus-6-train	EN	Here's fifty dollars in case you run into trouble.
5844	corpus-6-dev	EN	The main dining room will be open at eight and it closes at ten.
5846	corpus-6-train	EN	Shall we make out two checks.
5847	corpus-6-test-corpus-26-train	EN	Please give this syrup to your child, one measure, after every meal.
5848	corpus-6-test-corpus-26-train	EN	This style is available in twenty-eight , thirty-one and thirty five centimeter sizes.
5849	corpus-6-train	EN	How do you feel? They are made in Switzerland and in fashion here.
5853	corpus-6-dev	EN	What type of battery does it use?
5854	corpus-6-dev	EN	I'd like a children's book, please.
5859	corpus-6-dev	EN	I'm sorry, but I'd like to cancel my reservation.
5861	corpus-6-train	EN	Sorry, I don't like it.
5862	corpus-6-train	EN	What else is there to see in that part of town?
5863	corpus-6-train	EN	Books and pamphlets.
5865	corpus-6-train	EN	Hand over.
5866	corpus-6-train	EN	Go down two blocks. It's at the corner.
5867	corpus-6-dev	EN	Where's the popular disco?
5870	corpus-6-train	EN	That hilltop hotel has a fine view of the city, hasn't it?
5871	corpus-6-train	EN	How much should I put in?
5872	corpus-6-dev	EN	I'd like to watch professional baseball game.
5873	corpus-6-train	EN	Please call me an ambulance.
5875	corpus-6-test-corpus-26-train	EN	Oh, that sounds like a lot.
5876	corpus-6-train	EN	Well, I must have forgotten it. Thanks for checking.
5877	corpus-6-train	EN	This is my business card. I'm in charge of furniture import to Japan.
5879	corpus-6-train	EN	My colleague, Mr. Takemi, suggested I call you. He's one of your patients.
5880	corpus-6-dev	EN	I have another engagement on that day.
5881	corpus-6-train	EN	How do I get back?
5884	corpus-6-train	EN	See you on Monday.
5885	corpus-6-dev	EN	Do you have this in green?
5886	corpus-6-train	EN	I'm new here.
5887	corpus-6-train	EN	I'm missing my wine.
5889	corpus-6-train	EN	I'm an insurance agent.
5890	corpus-6-train	EN	What kind of appetizers do you have?
5891	corpus-6-train	EN	Indeed.
5892	corpus-6-train	EN	Some unavoidable business has come up.
5893	corpus-6-train	EN	The conditions of the contract are clear, but I couldn't quite understand the point after that.
5895	corpus-6-train	EN	Yes, some of our rooms have a park view, but they cost more.
5896	corpus-6-train	EN	Why then, it must have dropped out of my pocket. I must report this to hotel detective.
5898	corpus-6-test-corpus-26-train	EN	May I use your telephone?
5899	corpus-6-train	EN	Do you have a discount for weekly stay?
5900	corpus-6-train	EN	I've paid all my bill.
5902	corpus-6-test-corpus-26-test	EN	That smells very nice. How much is it?
5904	corpus-6-train	EN	I'd like to reserve a tennis court for an hour tomorrow.
5906	corpus-6-test-corpus-26-train	EN	I'd like to reconfirm my flight to Chicago on the seventeenth.
5907	corpus-6-train	EN	Do you have any rental rackets?
5908	corpus-6-train	EN	No, we came here last year.
5912	corpus-6-train	EN	Can you describe the person?
5913	corpus-6-test-corpus-26-train	EN	I've eaten a little too much.
5914	corpus-6-test-corpus-26-train	EN	May I talk to Ms Brown?
5915	corpus-6-train	EN	Please let me off.
5916	corpus-6-test-corpus-26-train	EN	This house seems to be comfortable to live in, doesn't it?
5923	corpus-6-train	EN	I don't want it at that price.
5924	corpus-6-train	EN	Cheers.
5925	corpus-6-train	EN	Okay, I'll send our engineer to your room.
5926	corpus-6-train	EN	I am allergic to the following.
5929	corpus-6-dev	EN	Yes. I've got it right here. May I see your driver's license, please?
5931	corpus-6-train	EN	You've been a great help to us today.
